{
  "energy_ledger_id": "energy:demo:acme-cooperative-foods-ltd:0001",
  "resolver_run_id": "resolver-run:demo:regis-acr:0001",
  "candidate_id": "canonical:acme-cooperative-foods-ltd",
  "top_entity_id": "canonical:acme-cooperative-foods-ltd",
  "runnerup_entity_id": "canonical:acme-foods-coop-alt",
  "top_score": 0.86,
  "runnerup_score": 0.82,
  "margin_delta": 0.04,
  "winner_flip_rate": 0.2,
  "candidate_count": 2,
  "claim_count_total": 1,
  "positive_evidence_only": true,
  "thresholds": {
    "review_threshold": 0.7,
    "insert_threshold": 0.95,
    "margin_threshold": 0.1,
    "max_flip_rate": 0.05
  },
  "promotion_allowed": false,
  "promotion_decision": "blocked_or_review_required",
  "policy_id": "policy://regis-acr/default-promotion@0.1.0",
  "created_at": "2026-05-06T00:00:00Z"
}
